{"$defs":{"CanvasSpec":{"additionalProperties":false,"properties":{"height":{"maximum":16000,"minimum":512,"title":"Height","type":"integer"},"width":{"maximum":4096,"minimum":512,"title":"Width","type":"integer"}},"required":["width","height"],"title":"CanvasSpec","type":"object"},"CharacterPosition":{"additionalProperties":false,"properties":{"center":{"$ref":"#/$defs/NormalizedPoint"},"character_id":{"format":"uuid","title":"Character Id","type":"string"},"prominence":{"enum":["primary","secondary","background"],"title":"Prominence","type":"string"}},"required":["character_id","center","prominence"],"title":"CharacterPosition","type":"object"},"FrameSpec":{"additionalProperties":false,"properties":{"aspect_ratio":{"exclusiveMinimum":0,"maximum":10,"title":"Aspect Ratio","type":"number"},"character_positions":{"items":{"$ref":"#/$defs/CharacterPosition"},"maxItems":20,"title":"Character Positions","type":"array"},"crop_safe_rect":{"$ref":"#/$defs/NormalizedRect"},"focal_point":{"$ref":"#/$defs/NormalizedPoint"},"frame_id":{"format":"uuid","title":"Frame Id","type":"string"},"order":{"anyOf":[{"maximum":100,"minimum":1,"type":"integer"},{"type":"null"}],"default":null,"title":"Order"},"panel_id":{"anyOf":[{"format":"uuid","type":"string"},{"type":"null"}],"default":null,"title":"Panel Id"},"parent_frame_id":{"anyOf":[{"format":"uuid","type":"string"},{"type":"null"}],"default":null,"title":"Parent Frame Id"},"rect":{"$ref":"#/$defs/NormalizedRect"},"shot_scale":{"enum":["extreme_close_up","close_up","medium","full","wide","establishing"],"title":"Shot Scale","type":"string"},"text_safe_zones":{"items":{"$ref":"#/$defs/TextSafeZone"},"maxItems":20,"title":"Text Safe Zones","type":"array"}},"required":["frame_id","rect","aspect_ratio","shot_scale","focal_point","crop_safe_rect"],"title":"FrameSpec","type":"object"},"NormalizedPoint":{"additionalProperties":false,"properties":{"x":{"maximum":1,"minimum":0,"title":"X","type":"number"},"y":{"maximum":1,"minimum":0,"title":"Y","type":"number"}},"required":["x","y"],"title":"NormalizedPoint","type":"object"},"NormalizedRect":{"additionalProperties":false,"properties":{"height":{"exclusiveMinimum":0,"maximum":1,"title":"Height","type":"number"},"width":{"exclusiveMinimum":0,"maximum":1,"title":"Width","type":"number"},"x":{"maximum":1,"minimum":0,"title":"X","type":"number"},"y":{"maximum":1,"minimum":0,"title":"Y","type":"number"}},"required":["x","y","width","height"],"title":"NormalizedRect","type":"object"},"TextSafeZone":{"additionalProperties":false,"properties":{"kind":{"enum":["dialogue","narration","sfx","any"],"title":"Kind","type":"string"},"rect":{"$ref":"#/$defs/NormalizedRect"},"zone_id":{"format":"uuid","title":"Zone Id","type":"string"}},"required":["zone_id","kind","rect"],"title":"TextSafeZone","type":"object"}},"$id":"https://manga-maker.local/contracts/v0.3/page-layout-draft.schema.json","$schema":"https://json-schema.org/draft/2020-12/schema","additionalProperties":false,"properties":{"approved_content_sha256":{"anyOf":[{"pattern":"^[0-9a-f]{64}$","type":"string"},{"type":"null"}],"default":null,"title":"Approved Content Sha256"},"canvas":{"$ref":"#/$defs/CanvasSpec"},"content_sha256":{"pattern":"^[0-9a-f]{64}$","title":"Content Sha256","type":"string"},"frames":{"items":{"$ref":"#/$defs/FrameSpec"},"maxItems":100,"minItems":1,"title":"Frames","type":"array"},"page_id":{"format":"uuid","title":"Page Id","type":"string"},"page_layout_draft_id":{"format":"uuid","title":"Page Layout Draft Id","type":"string"},"page_profile":{"enum":["print_portrait_2_3","digital_portrait_2_3","vertical_strip"],"title":"Page Profile","type":"string"},"reading_direction":{"enum":["ltr_ttb","rtl_ttb","ttb"],"title":"Reading Direction","type":"string"},"schema_version":{"const":"1.0","default":"1.0","title":"Schema Version","type":"string"},"version":{"minimum":1,"title":"Version","type":"integer"}},"required":["page_layout_draft_id","version","page_id","page_profile","canvas","reading_direction","frames","content_sha256"],"title":"PageLayoutDraft","type":"object"}
