{
  "schema_version": "1.0",
  "page_layout_draft_id": "01900000-0000-7000-8000-000000002001",
  "version": 1,
  "page_id": "01900000-0000-7000-8000-000000002002",
  "page_profile": "print_portrait_2_3",
  "canvas": {"width": 2048, "height": 3072},
  "reading_direction": "ltr_ttb",
  "frames": [
    {
      "frame_id": "01900000-0000-7000-8000-000000002000",
      "parent_frame_id": null,
      "panel_id": null,
      "order": null,
      "rect": {"x": 0, "y": 0, "width": 1, "height": 1},
      "aspect_ratio": 0.6666666666666666,
      "shot_scale": "establishing",
      "focal_point": {"x": 0.5, "y": 0.5},
      "character_positions": [],
      "text_safe_zones": [],
      "crop_safe_rect": {"x": 0, "y": 0, "width": 1, "height": 1}
    },
    {
      "frame_id": "01900000-0000-7000-8000-000000002011",
      "parent_frame_id": "01900000-0000-7000-8000-000000002000",
      "panel_id": "01900000-0000-7000-8000-000000002101",
      "order": 1,
      "rect": {"x": 0.02, "y": 0.02, "width": 0.47, "height": 0.306},
      "aspect_ratio": 1.0239651416122004,
      "shot_scale": "medium",
      "focal_point": {"x": 0.5, "y": 0.5},
      "character_positions": [],
      "text_safe_zones": [],
      "crop_safe_rect": {"x": 0.05, "y": 0.05, "width": 0.9, "height": 0.9}
    },
    {
      "frame_id": "01900000-0000-7000-8000-000000002012",
      "parent_frame_id": "01900000-0000-7000-8000-000000002000",
      "panel_id": "01900000-0000-7000-8000-000000002102",
      "order": 2,
      "rect": {"x": 0.51, "y": 0.02, "width": 0.47, "height": 0.306},
      "aspect_ratio": 1.0239651416122004,
      "shot_scale": "medium",
      "focal_point": {"x": 0.5, "y": 0.5},
      "character_positions": [],
      "text_safe_zones": [],
      "crop_safe_rect": {"x": 0.05, "y": 0.05, "width": 0.9, "height": 0.9}
    },
    {
      "frame_id": "01900000-0000-7000-8000-000000002013",
      "parent_frame_id": "01900000-0000-7000-8000-000000002000",
      "panel_id": "01900000-0000-7000-8000-000000002103",
      "order": 3,
      "rect": {"x": 0.02, "y": 0.347, "width": 0.47, "height": 0.306},
      "aspect_ratio": 1.0239651416122004,
      "shot_scale": "close_up",
      "focal_point": {"x": 0.5, "y": 0.5},
      "character_positions": [],
      "text_safe_zones": [],
      "crop_safe_rect": {"x": 0.05, "y": 0.05, "width": 0.9, "height": 0.9}
    },
    {
      "frame_id": "01900000-0000-7000-8000-000000002014",
      "parent_frame_id": "01900000-0000-7000-8000-000000002000",
      "panel_id": "01900000-0000-7000-8000-000000002104",
      "order": 4,
      "rect": {"x": 0.51, "y": 0.347, "width": 0.47, "height": 0.306},
      "aspect_ratio": 1.0239651416122004,
      "shot_scale": "medium",
      "focal_point": {"x": 0.5, "y": 0.5},
      "character_positions": [],
      "text_safe_zones": [],
      "crop_safe_rect": {"x": 0.05, "y": 0.05, "width": 0.9, "height": 0.9}
    },
    {
      "frame_id": "01900000-0000-7000-8000-000000002015",
      "parent_frame_id": "01900000-0000-7000-8000-000000002000",
      "panel_id": "01900000-0000-7000-8000-000000002105",
      "order": 5,
      "rect": {"x": 0.02, "y": 0.674, "width": 0.47, "height": 0.306},
      "aspect_ratio": 1.0239651416122004,
      "shot_scale": "wide",
      "focal_point": {"x": 0.5, "y": 0.5},
      "character_positions": [],
      "text_safe_zones": [],
      "crop_safe_rect": {"x": 0.05, "y": 0.05, "width": 0.9, "height": 0.9}
    },
    {
      "frame_id": "01900000-0000-7000-8000-000000002016",
      "parent_frame_id": "01900000-0000-7000-8000-000000002000",
      "panel_id": "01900000-0000-7000-8000-000000002106",
      "order": 6,
      "rect": {"x": 0.51, "y": 0.674, "width": 0.47, "height": 0.306},
      "aspect_ratio": 1.0239651416122004,
      "shot_scale": "establishing",
      "focal_point": {"x": 0.5, "y": 0.5},
      "character_positions": [],
      "text_safe_zones": [],
      "crop_safe_rect": {"x": 0.05, "y": 0.05, "width": 0.9, "height": 0.9}
    }
  ],
  "content_sha256": "0000000000000000000000000000000000000000000000000000000000000000",
  "approved_content_sha256": null
}
